[
  {
    "id": "startup_run_led_strip_dim_white",
    "description": "Set LED strip to low-brightness white once the device finishes booting.",
    "enabled": false,
    "consume_on_match": false,
    "ack": "startup led strip brightness set to 10",
    "match": {
      "source_cap": "app_claw",
      "event_type": "startup",
      "event_key": "boot_completed",
      "content_type": "trigger"
    },
    "actions": [
      {
        "type": "run_script",
        "input": {
          "path": "/fatfs/skills/light_switch/scripts/led_strip_switch.lua",
          "args": {
            "enabled": true,
            "brightness": 10,
            "color": {
              "r": 255,
              "g": 255,
              "b": 255
            }
          }
        }
      }
    ]
  },
  {
    "id": "im_session_command",
    "description": "Handle global numeric AgentSystem session commands when the user sends /session.",
    "enabled": true,
    "consume_on_match": true,
    "ack": "{{event.source_channel}} session command handled",
    "match": {
      "event_type": "message",
      "event_key": "text",
      "content_type": "text",
      "text": "/session",
      "text_match_rule": "prefix"
    },
    "actions": [
      {
        "type": "call_cap",
        "cap": "agent",
        "input": {
          "method": "session.command",
          "args": {
            "text": "{{event.text}}"
          }
        }
      },
      {
        "type": "send_message",
        "input": {
          "channel": "{{event.source_channel}}",
          "chat_id": "{{event.chat_id}}"
        }
      }
    ]
  },
  {
    "id": "im_any_message_working_reply",
    "description": "Reply to any IM text message before other automation handling.",
    "enabled": true,
    "consume_on_match": false,
    "ack": "{{event.source_channel}} working reply sent",
    "match": {
      "event_type": "message",
      "event_key": "text",
      "content_type": "text"
    },
    "actions": [
      {
        "type": "send_message",
        "input": {
          "channel": "{{event.source_channel}}",
          "chat_id": "{{event.chat_id}}",
          "message": "🦞 ESP-Claw is snapping on it..."
        }
      }
    ]
  },
  {
    "id": "im_attachment_saved_reply",
    "description": "Reply when an IM attachment is saved.",
    "enabled": true,
    "ack": "{{event.channel}} attachment saved",
    "match": {
      "event_type": "attachment_saved"
    },
    "actions": [
      {
        "type": "send_message",
        "input": {
          "channel": "{{event.source_channel}}",
          "chat_id": "{{event.chat_id}}",
          "message": "File received from {{event.source_channel}}"
        }
      }
    ]
  },
  {
    "id": "agent_out_message",
    "description": "Send completed Agent output to the outbound channel bound by the originating IM route.",
    "enabled": true,
    "consume_on_match": true,
    "ack": "agent output sent",
    "match": {
      "source_cap": "agent",
      "event_type": "out_message"
    },
    "actions": [
      {
        "type": "send_message",
        "input": {
          "message": "{{event.text}}"
        }
      }
    ]
  },
  {
    "id": "im_any_message_agent",
    "description": "Route IM text messages to the agent.",
    "enabled": true,
    "consume_on_match": true,
    "ack": "{{event.source_channel}} routed to agent",
    "match": {
      "event_type": "message",
      "event_key": "text",
      "content_type": "text"
    },
    "actions": [
      {
        "type": "call_cap",
        "cap": "agent",
        "input": {
          "method": "session.input",
          "args": {
            "text": "{{event.text}}"
          }
        }
      }
    ]
  }
]
